{
  "$schema": "https://json-schema.org/draft/2020-12/schema",
  "$id": "https://transformer.local/contracts/flight/v17/capabilities-result.schema.json",
  "title": "transformer.v17.capabilities result",
  "type": "object", "additionalProperties": false,
  "required": ["requestId", "devices", "limits", "queries", "semantic"],
  "properties": {
    "requestId": {"$ref": "common.schema.json#/$defs/uuid"},
    "devices": {
      "type": "object", "additionalProperties": false, "required": ["cpu", "gpu"],
      "properties": {
        "cpu": {"type": "object", "additionalProperties": false, "required": ["available"], "properties": {"available": {"const": true}}},
        "gpu": {"type": "object", "additionalProperties": false, "required": ["available"], "properties": {"available": {"type": "boolean"}}}
      }
    },
    "limits": {"$ref": "fit-create-result.schema.json#/$defs/limits"},
    "queries": {"type": "object", "additionalProperties": false, "required": ["modelCatalog", "modelTopology", "trainingTelemetry"], "properties": {"modelCatalog": {"type": "boolean"}, "modelTopology": {"type": "boolean"}, "trainingTelemetry": {"type": "boolean"}}},
    "semantic": {"$ref": "https://transformer.local/contracts/semantic/v4/language-capabilities.schema.json"}
  }
}
