{
  "requestId": "11111111-1111-4111-8111-111111111111",
  "devices": {
    "cpu": {"available": true},
    "gpu": {"available": true}
  },
  "limits": {
    "maxPayloadBytes": 536870912,
    "maxRowsPerPayload": 2000000,
    "maxPayloadsPerJob": 100000,
    "maxJobBytes": 68719476736,
    "inputIdleTimeoutSeconds": 900
  },
  "queries": {
    "modelCatalog": true,
    "modelTopology": true,
    "trainingTelemetry": true
  },
  "semantic": {
    "objectiveLanguage": {
      "revision": 4,
      "closed": true
    },
    "semanticLimits": {
      "maxTargetSlots": 128,
      "maxObjectiveComponents": 256,
      "maxPrivateResources": 64
    },
    "directOperators": [
      "BinaryCrossEntropyWithLogits",
      "LogMSE",
      "PositiveClassWeightedBinaryCrossEntropyWithLogits",
      "SmoothL1"
    ]
  }
}
